mysql> use INVOICE;

mysql> select * from customer;
+---------+-------------------------+--------------------+------------+-------+
| cust_id | address                 | city               | ph_no      | name  |
+---------+-------------------------+--------------------+------------+-------+
|       1 | marakars kappad         | calicut            | NULL       | Amna  |
|       2 | sopanam panampillynagar | ernakulam          | NULL       | Arya  |
|       3 |  deepam gandhinagar     | thiruvananthapuram | 9567130694 | Manu  |
|       4 | geetha 2ndstreet        | alappuzha          | 9567130600 | Aami  |
|       5 | jannath kanjirapally    | kottayam           | 9568730600 | Nihal |
+---------+-------------------------+--------------------+------------+-------+
5 rows in set (0.04 sec)

mysql> update customer set city='kozhikode' where city='calicut';
Query OK, 1 row affected (0.15 sec)
Rows matched: 1  Changed: 1  Warnings: 0

mysql> select * from customer;
+---------+-------------------------+--------------------+------------+-------+
| cust_id | address                 | city               | ph_no      | name  |
+---------+-------------------------+--------------------+------------+-------+
|       1 | marakars kappad         | kozhikode          | NULL       | Amna  |
|       2 | sopanam panampillynagar | ernakulam          | NULL       | Arya  |
|       3 |  deepam gandhinagar     | thiruvananthapuram | 9567130694 | Manu  |
|       4 | geetha 2ndstreet        | alappuzha          | 9567130600 | Aami  |
|       5 | jannath kanjirapally    | kottayam           | 9568730600 | Nihal |
+---------+-------------------------+--------------------+------------+-------+
5 rows in set (0.00 sec)

mysql> update customer set ph_no='6282418462' where name='Nihal';
Query OK, 1 row affected (0.12 sec)
Rows matched: 1  Changed: 1  Warnings: 0

mysql> select * from customer;
+---------+-------------------------+--------------------+------------+-------+
| cust_id | address                 | city               | ph_no      | name  |
+---------+-------------------------+--------------------+------------+-------+
|       1 | marakars kappad         | kozhikode          | NULL       | Amna  |
|       2 | sopanam panampillynagar | ernakulam          | NULL       | Arya  |
|       3 |  deepam gandhinagar     | thiruvananthapuram | 9567130694 | Manu  |
|       4 | geetha 2ndstreet        | alappuzha          | 9567130600 | Aami  |
|       5 | jannath kanjirapally    | kottayam           | 6282418462 | Nihal |
+---------+-------------------------+--------------------+------------+-------+
5 rows in set (0.00 sec)