mysql> use INVOICE;
Database changed
mysql> show tables;
+-------------------+
| Tables_in_invoice |
+-------------------+
| customer          |
| invoice_item      |
| invoice_master    |
| product           |
+-------------------+
4 rows in set (0.16 sec)

mysql> select * from invoice_item;
+--------+------+----------+
| inv_id | p_id | quantity |
+--------+------+----------+
|      1 | 1000 |        5 |
|      2 | 1001 |       15 |
|      3 | 1002 |       40 |
|      4 | 1003 |       25 |
|      5 | 1003 |        7 |
+--------+------+----------+
5 rows in set (0.25 sec)

mysql> select * from invoice_master;
+--------+---------+------------+
| inv_id | cust_id | inv_date   |
+--------+---------+------------+
|      1 |       1 | 2021-01-02 |
|      2 |       2 | 2021-01-10 |
|      3 |       3 | 2021-01-12 |
|      4 |       4 | 2021-03-21 |
|      5 |       5 | 2021-02-26 |
+--------+---------+------------+
5 rows in set (0.06 sec)

mysql> delete from invoice_item where inv_id=3;
Query OK, 1 row affected (0.03 sec)

mysql> delete from invoice_master where inv_id=3;
Query OK, 1 row affected (0.00 sec)

mysql> select * from invoice_master;
+--------+---------+------------+
| inv_id | cust_id | inv_date   |
+--------+---------+------------+
|      1 |       1 | 2021-01-02 |
|      2 |       2 | 2021-01-10 |
|      4 |       4 | 2021-03-21 |
|      5 |       5 | 2021-02-26 |
+--------+---------+------------+
4 rows in set (0.00 sec)

mysql> select * from invoice_item;
+--------+------+----------+
| inv_id | p_id | quantity |
+--------+------+----------+
|      1 | 1000 |        5 |
|      2 | 1001 |       15 |
|      4 | 1003 |       25 |
|      5 | 1003 |        7 |
+--------+------+----------+
4 rows in set (0.00 sec)
