mysql> select * from customer;
+---------+-------------------------+--------------------+------------+-------+
| cust_id | address                 | city               | ph_no      | name  |
+---------+-------------------------+--------------------+------------+-------+
|       1 | marakars kappad         | kozhikode          | NULL       | Amna  |
|       2 | sopanam panampillynagar | ernakulam          | NULL       | Arya  |
|       3 |  deepam gandhinagar     | thiruvananthapuram | 9567130694 | Manu  |
|       4 | geetha 2ndstreet        | alappuzha          | 9567130600 | Aami  |
|       5 | jannath kanjirapally    | kottayam           | 6282418462 | Nihal |
|       6 | Mannath Marinedrive     | Ernakulam          | 9946031339 | Nuha  |
+---------+-------------------------+--------------------+------------+-------+
6 rows in set (0.00 sec)

mysql> delete from customer where name='Nuha';
Query OK, 1 row affected (0.15 sec)

mysql> select * from customer;
+---------+-------------------------+--------------------+------------+-------+
| cust_id | address                 | city               | ph_no      | name  |
+---------+-------------------------+--------------------+------------+-------+
|       1 | marakars kappad         | kozhikode          | NULL       | Amna  |
|       2 | sopanam panampillynagar | ernakulam          | NULL       | Arya  |
|       3 |  deepam gandhinagar     | thiruvananthapuram | 9567130694 | Manu  |
|       4 | geetha 2ndstreet        | alappuzha          | 9567130600 | Aami  |
|       5 | jannath kanjirapally    | kottayam           | 6282418462 | Nihal |
+---------+-------------------------+--------------------+------------+-------+
5 rows in set (0.00 sec)